{
 "schemaVersion": "1.0",
 "schema": "data/schema/kosa-macrostructure.schema.json",
 "generatedBy": "scripts/lexico/m10_kosa_macrostructure_model.py",
 "generatedAt": "2026-09-24T02:16:11.167Z",
 "license": "CC-BY-SA-4.0",
 "licenseUrl": "https://creativecommons.org/licenses/by-sa/4.0/",
 "kosha": {
  "code": "ARMH",
  "title": "Abhidhānaratnamālā",
  "author": "Halāyudha",
  "tradition": "Brahmanical",
  "date": "~10th c.",
  "source": {
   "upstream": "sanskrit-lexicon/csl-orig",
   "path": "v02/armh/armh.txt",
   "revision": "f4c08c578b330e2379e38f54d3a541f1564b8eee",
   "licence": "CC-BY-SA-4.0"
  }
 },
 "macrostructureType": "onomasiological-versified",
 "digitizationModel": "exploded",
 "genderMarking": false,
 "sample": {
  "isSample": true,
  "plan": [
   {
    "unit": "1",
    "unitIast": "1",
    "groups": 6
   },
   {
    "unit": "5",
    "unitIast": "5",
    "groups": 4
   }
  ],
  "note": "Every division is listed with its full-text counts; only the planned verse-groups are expanded."
 },
 "orderingDevices": [
  {
   "device": "kanda",
   "evidence": "observed",
   "layer": "digitization-markup",
   "level": "division",
   "note": "Only as the first field of the <vn> locator; no kāṇḍa headings in the digitization."
  },
  {
   "device": "varga",
   "evidence": "absent",
   "layer": "digitization-markup",
   "level": "division",
   "note": "The <vn> locator does not vary below the kāṇḍa (A06 §6)."
  },
  {
   "device": "verse",
   "evidence": "observed",
   "layer": "source-text",
   "level": "group",
   "note": "Verse-end numbers in the text; the <vn> groups the exploded records."
  },
  {
   "device": "synonym-set",
   "evidence": "absent",
   "layer": "digitization-markup",
   "level": "set",
   "note": "Exploded model: one record per synonym, set boundaries inside a verse not encoded."
  },
  {
   "device": "homonym-section",
   "evidence": "inferred",
   "layer": "measurement",
   "level": "division",
   "note": "kāṇḍa 5 identified as anekārtha from its '…api…' formula (A06 §4.2), not from a heading."
  },
  {
   "device": "gender-marking",
   "evidence": "absent",
   "layer": "digitization-markup",
   "level": "member",
   "note": "No liṅga tags in the digitization."
  },
  {
   "device": "alphabetical-order",
   "evidence": "inferred",
   "layer": "measurement",
   "level": "member",
   "note": "Adjacent-headword non-decreasing share 0.4985 — chance level."
  }
 ],
 "kandas": [
  {
   "n": 1,
   "label": null,
   "labelIast": null,
   "labelStatus": "numeric-locator-only",
   "vargas": [
    {
     "n": 1,
     "label": null,
     "labelIast": null,
     "labelStatus": "not-divided-in-source",
     "sectionType": "synonymic",
     "sectionTypeBasis": "default",
     "counts": {
      "groups": 138,
      "sets": 138,
      "members": 1462,
      "fullVerses": 138
     },
     "groups": [
      {
       "L": "1",
       "sourceLine": 1,
       "upavarga": null,
       "upavargaIast": null,
       "locator": "1.1.1.3",
       "verseRefs": [
        {
         "n": 3,
         "half": false
        }
       ],
       "verseLines": [
        "dyOrgOramartyaBuvanaM nAkaH syAdUrDvalokaSca .. 3 .."
       ],
       "sets": [
        {
         "eid": null,
         "kind": "unsegmented-verse",
         "members": [
          {
           "form": "svar",
           "formIast": "svar",
           "role": "synonym",
           "gender": null
          },
          {
           "form": "svarga",
           "formIast": "svarga",
           "role": "synonym",
           "gender": null
          },
          {
           "form": "surasadman",
           "formIast": "surasadman",
           "role": "synonym",
           "gender": null
          },
          {
           "form": "tridaSAvAsa",
           "formIast": "tridaśāvāsa",
           "role": "synonym",
           "gender": null
          },
          {
           "form": "trivizwapa",
           "formIast": "triviṣṭapa",
           "role": "synonym",
           "gender": null
          },
          {
           "form": "tridiva",
           "formIast": "tridiva",
           "role": "synonym",
           "gender": null
          },
          {
           "form": "dyo",
           "formIast": "dyo",
           "role": "synonym",
           "gender": null
          },
          {
           "form": "go",
           "formIast": "go",
           "role": "synonym",
           "gender": null
          },
          {
           "form": "amartyaBuvana",
           "formIast": "amartyabhuvana",
           "role": "synonym",
           "gender": null
          },
          {
           "form": "nAka",
           "formIast": "nāka",
           "role": "synonym",
           "gender": null
          },
          {
           "form": "UrDvaloka",
           "formIast": "ūrdhvaloka",
           "role": "synonym",
           "gender": null
          }
         ]
        }
       ]
      },
      {
       "L": "12",
       "sourceLine": 67,
       "upavarga": null,
       "upavargaIast": null,
       "locator": "1.1.1.4",
       "verseRefs": [
        {
         "n": 4,
         "half": false
        }
       ],
       "verseLines": [
        "tyAKyAtA amftASanA animizA devAstaTA dEvatam .. 4 .."
       ],
       "sets": [
        {
         "eid": null,
         "kind": "unsegmented-verse",
         "members": [
          {
           "form": "Aditya",
           "formIast": "āditya",
           "role": "synonym",
           "gender": null
          },
          {
           "form": "tridaSa",
           "formIast": "tridaśa",
           "role": "synonym",
           "gender": null
          },
          {
           "form": "sura",
           "formIast": "sura",
           "role": "synonym",
           "gender": null
          },
          {
           "form": "sumanas",
           "formIast": "sumanas",
           "role": "synonym",
           "gender": null
          },
          {
           "form": "svargOkas",
           "formIast": "svargaukas",
           "role": "synonym",
           "gender": null
          },
          {
           "form": "devatA",
           "formIast": "devatā",
           "role": "synonym",
           "gender": null
          },
          {
           "form": "gIrvARa",
           "formIast": "gīrvāṇa",
           "role": "synonym",
           "gender": null
          },
          {
           "form": "fBu",
           "formIast": "ṛbhu",
           "role": "synonym",
           "gender": null
          },
          {
           "form": "amara",
           "formIast": "amara",
           "role": "synonym",
           "gender": null
          },
          {
           "form": "marut",
           "formIast": "marut",
           "role": "synonym",
           "gender": null
          },
          {
           "form": "vfndAraka",
           "formIast": "vṛndāraka",
           "role": "synonym",
           "gender": null
          },
          {
           "form": "nirjara",
           "formIast": "nirjara",
           "role": "synonym",
           "gender": null
          },
          {
           "form": "asvapna",
           "formIast": "asvapna",
           "role": "synonym",
           "gender": null
          },
          {
           "form": "vibuDa",
           "formIast": "vibudha",
           "role": "synonym",
           "gender": null
          },
          {
           "form": "trivizwapasad",
           "formIast": "triviṣṭapasad",
           "role": "synonym",
           "gender": null
          },
          {
           "form": "leKa",
           "formIast": "lekha",
           "role": "synonym",
           "gender": null
          },
          {
           "form": "suparvan",
           "formIast": "suparvan",
           "role": "synonym",
           "gender": null
          },
          {
           "form": "amftASana",
           "formIast": "amṛtāśana",
           "role": "synonym",
           "gender": null
          },
          {
           "form": "animiza",
           "formIast": "animiṣa",
           "role": "synonym",
           "gender": null
          },
          {
           "form": "deva",
           "formIast": "deva",
           "role": "synonym",
           "gender": null
          },
          {
           "form": "dEvata",
           "formIast": "daivata",
           "role": "synonym",
           "gender": null
          }
         ]
        }
       ]
      },
      {
       "L": "33",
       "sourceLine": 235,
       "upavarga": null,
       "upavargaIast": null,
       "locator": "1.1.1.5",
       "verseRefs": [
        {
         "n": 5,
         "half": false
        }
       ],
       "verseLines": [
        "pUrvadevAH SukraSizyAH pAtAlanilayAH smftAH .. 5 .."
       ],
       "sets": [
        {
         "eid": null,
         "kind": "unsegmented-verse",
         "members": [
          {
           "form": "asura",
           "formIast": "asura",
           "role": "synonym",
           "gender": null
          },
          {
           "form": "dAnava",
           "formIast": "dānava",
           "role": "synonym",
           "gender": null
          },
          {
           "form": "dEtya",
           "formIast": "daitya",
           "role": "synonym",
           "gender": null
          },
          {
           "form": "dEteya",
           "formIast": "daiteya",
           "role": "synonym",
           "gender": null
          },
          {
           "form": "suraSatru",
           "formIast": "suraśatru",
           "role": "synonym",
           "gender": null
          },
          {
           "form": "pUrvadeva",
           "formIast": "pūrvadeva",
           "role": "synonym",
           "gender": null
          },
          {
           "form": "SukraSizya",
           "formIast": "śukraśiṣya",
           "role": "synonym",
           "gender": null
          },
          {
           "form": "pAtAlanilaya",
           "formIast": "pātālanilaya",
           "role": "synonym",